EVENT_ID,CZ_NAME_STR,BEGIN_LOCATION,BEGIN_DATE,BEGIN_TIME,EVENT_TYPE,MAGNITUDE,TOR_F_SCALE,DEATHS_DIRECT,INJURIES_DIRECT,DAMAGE_PROPERTY_NUM,DAMAGE_CROPS_NUM,STATE_ABBR,CZ_TIMEZONE,MAGNITUDE_TYPE,EPISODE_ID,CZ_TYPE,CZ_FIPS,WFO,INJURIES_INDIRECT,DEATHS_INDIRECT,SOURCE,FLOOD_CAUSE,TOR_LENGTH,TOR_WIDTH,BEGIN_RANGE,BEGIN_AZIMUTH,END_RANGE,END_AZIMUTH,END_LOCATION,END_DATE,END_TIME,BEGIN_LAT,BEGIN_LON,END_LAT,END_LON,EVENT_NARRATIVE,EPISODE_NARRATIVE,ABSOLUTE_ROWNUMBER
463541,PHILADELPHIA CO.,ROXBOROUGH,06/07/2013,1330,Flood, , ,0,0,0,0,PA,EST-5, ,73550,C,101,PHI,0,0,River/Stream Gage,Heavy Rain, , ,2,NW,2,WNW,BUSTLETON,06/08/2013,330,40.0689,-75.2527,40.0902,-75.0593,"Flooding occurred along several gaged rivers and creeks in Philadelphia County.  The Wissahickon Creek at the mouth in Philadelphia was above its 5 foot flood stage from 349 p.m. EDT on the 7th through 529 a.m. EDT on the 8th. It crested at 5.99 feet at 1230 a.m. EDT on the 8th.  The Frankford Creek at Castor Avenue in Philadelphia was above its 7 foot flood stage from 405 p.m. EDT through 421 p.m. EDT on the 7th, and it crested at 7.28 feet at 415 p.m. EDT.  The Pennypack Creek at the Rhawn Street Bridge in Philadelphia was above its 7 foot flood stage from 405 p.m. EDT through 449 p.m. EDT on the 7th, and it crested at 7.67 feet at 415 p.m. EDT.  The Pennypack Creek at the Rhawn Street Bridge in Philadelphia rose above its flood stage a second time due to additional heavy rains. It was above its 7 foot flood stage from 645 p.m. EDT on the 7th through 210 a.m. EDT on the 8th, and it crested at 8.21 feet at 1230 a.m. EDT on the 8th.  The tidal Delaware River at Philadelphia was above its 8.2 foot flood stage from 113 a.m. EDT through 223 a.m. EDT on the 8th, and it crested at 8.41 feet.  Event precipitation totals included 4.63 inches in Red Bank, 4.03 inches in Rockledge, 3.82 inches at the Philadelphia International Airport, and 3.71 inches at the Northeast Philadelphia Airport.","The remnants of Tropical Storm Andrea moving up the Eastern Seaboard, from the Southeast States to the Mid Atlantic and Northeast Coasts, led to waves of heavy rain and thunderstorms from the early morning hours through the late evening on the 7th. The initial burst of heavy precipitation arrived during the early morning on the 7th as moisture surged into the Mid Atlantic Region ahead of Tropical Storm Andrea, with the center of its low pressure located near the coast of Georgia. Through the course of the day, the cyclone became post-tropical as it accelerated northeastward along the East Coast of the United States, delivering another round of heavy rain with some strong thunderstorms to the Mid Atlantic States during the late afternoon and evening of the 7th. ||Doppler radar storm total estimates ranged from around 2 to 4 inches of rain for the event across eastern Pennsylvania.  Waves of heavy precipitation resulted in areas of flooding, including along Chester Creek in Delaware County.",70
465546,PHILADELPHIA CO.,ROXBOROUGH,06/10/2013,2200,Flood, , ,0,0,0,0,PA,EST-5, ,73585,C,101,PHI,0,0,River/Stream Gage,Heavy Rain, , ,2,NW,2,WNW,BUSTLETON,06/11/2013,400,40.0681,-75.2537,40.0894,-75.0597,"Runoff from heavy rain that fell during the 10th led to flooding along gaged rivers and creeks in Philadelphia County. The Wissahickon Creek at the mouth in Philadelphia was above its 5 foot flood stage from 1135 p.m. EDT on the 10th through 425 a.m. EDT on the 11th. It crested at 5.60 feet at 200 a.m. EDT on the 11th. The tidal Delaware River at Philadelphia was above its 8.2 foot flood stage from 306 a.m. EDT through 413 a.m. EDT on the 11th, and it crested at 8.40 feet. Event precipitation totals included 2.20 inches in Rockledge and 1.37 inches in Philadelphia.",Heavy rain that moved across southeast Pennsylvania during the day on the 10th caused renewed flooding in the area. Event precipitation totals averaged between 1.5 and 3.5 inches.,71
475444,PHILADELPHIA CO.,FOX CHASE,08/13/2013,1445,Flood, , ,0,0,0,0,PA,EST-5, ,76592,C,101,PHI,0,0,River/Stream Gage,Heavy Rain, , ,2,ESE,1,NNE,CRESCENTVILLE,08/13/2013,1901,40.0588,-75.0506,40.0497,-75.0929,The runoff from the morning heavy rain on the 13th continued flooding along some of the waterways in Philadelphia into the evening of the 13th. This was especially true of creeks whose sources are in Montgomery County as heavier rain fell in their headwater regions. The Pennypack Creek at the Rhawn Street Bridge was above its 7 foot flood stage from 848 a.m. EDT through 511 p.m. EDT on the 13th. It crested at 8.87 feet at 345 p.m. EDT. The Wissahickon Creek at its mouth within Philadelphia had moderate flooding and was above its 5 foot flood stage from 956 a.m. EDT through 801 p.m. EDT on the 13th. It crested at 7.23 feet at 415 p.m. EDT. Event precipitation totals included 2.20 inches at the Philadelphia International Airport and 1.93 inches in Northeast Philadelphia.,"A complex of showers and thunderstorms produced both wind damage and flash flooding in Berks County and southeastern Pennsylvania on the 13th. Doppler Radar storm total estimates averaged 2.5 to 7.0 inches, highest in Chester and Montgomery Counties. In addition to widespread poor drainage flooding, flooding also affected sections of the Brandywine and Wissahickon basins.  Major flooding occurred along sections of the Wissahickon and Valley Creeks. Vehicle water rescues were performed in Chester, Montgomery and lower Bucks Counties. The AAA of Mid-Atlantic reported a 60 percent increase in assistance calls. Because the torrential rain coincided with the morning commute, traffic on some interstates were backed up for hours. SEPTA commuter regional rail lines experienced on average thirty minute system-wide delays through the morning.  Arrival delays to Philadelphia International Airport reached 90 minutes.",72
475250,PHILADELPHIA CO.,CRESCENTVILLE,08/28/2013,1145,Flood, , ,0,0,0,0,PA,EST-5, ,79209,C,101,PHI,0,0,River/Stream Gage,Heavy Rain, , ,1,SSW,1,SSE,CRESCENTVILLE,08/28/2013,1201,40.0148,-75.106,40.0128,-75.0927,The Frankford Creek at Castor Avenue was briefly above its 7 foot flood stage from 1245 p.m. EDT through 101 p.m. EDT on the 28th. It crested at 7.19 feet. Event precipitation totals included 1.80 inches in Wyndmoor and 1.04 inches at the Philadelphia International Airport.,"An area of rain with embedded thunderstorms caused flash flooding in the Lehigh Valley and upper Bucks County and poor drainage flooding in Philadelphia as well as brief minor flooding along the Frankford Creek on the 28th. The rain started during the morning of the 28th, fell at its heaviest around Noon EDT and ended during the early evening of the 28th. Rainfall amounts varied across east central and southeast Pennsylvania, but averaged between 1 and 3 inches in most places. The precipitation formed and rode along a stationary front over Pennsylvania and New Jersey. This boundary started to sag southward during the late afternoon and night as a low pressure system that formed along the boundary passed south of Philadelphia.",73
485589,PHILADELPHIA CO.,FOX CHASE,11/27/2013,543,Flood, , ,0,0,0,0,PA,EST-5, ,79893,C,101,PHI,0,0,River/Stream Gage,Heavy Rain, , ,2,ESE,2,NNW,TACONY,11/27/2013,1032,40.0588,-75.0506,40.0458,-75.049,"The heavy rain contributed to a fatal accident on the Schuylkill Expressway (Interstate 76) in Philadelphia. About 430 a.m. EST on the 27th, a westbound Audi automobile hit a pool of water and spun out and hit the barrier and stopped. A minivan following stopped in time. But, a tractor-trailer behind it could not stop in time and struck a minivan.  A 47-year-old male passenger was killed and six other people were injured. The westbound lanes of the Schuylkill remained closed between Exit 341 (Montgomery Drive/West River Drive) and Exit 339 (U.S. Route 1 South - City Avenue) due to the accident.  The westbound side of the expressway completely reopened at 3 p.m. EST that afternoon.  On the eastbound side of the Schuylkill Expressway in nearly the same area, poor drainage flooding closed the expressway between Exit 340B (U.S. Route 1 North - Roosevelt Boulevard) and Exit 341 (Montgomery Drive/West River Drive). Cleanup included removing debris from the roadway. Three of the four lanes were reopened that afternoon.  Additional flooding forced the closure of Interstate 76 within Philadelphia at the 26th Street Tunnel after a cab became stuck in flood waters. The rain also contributed to accidents along Interstate 95 and the Pennsylvania Turnpike. | |The Pennypack Creek at the Rhawn Street Bridge was above its 7 foot flood stage from 543 a.m. EST through 1032 a.m. EST on the 27th. It crested at 7.52 feet at 715 a.m. EST. Event precipitation totals included 2.32 inches at the Northeast Philadelphia Airport and 2.28 inches at the Philadelphia International Airport.","Heavy rain associated with a low pressure system emerging from the Gulf of Mexico caused poor drainage as well as some creek flooding in southeastern Pennsylvania on the 27th. The rain also hampered getaway plans, caused many accidents, as travelers were starting their Thanksgiving holiday weekend trips. On the 27th, the rain and low clouds caused two hour arrival delays at Philadelphia International Airport and caused 60 departing flights to be cancelled. Rain began on the morning of the 26th and started falling heavy at times during the late evening of the 26th. The rain continued to fall heavy at times overnight. Lighter rain then continued through most of the afternoon of the 27th before ending. Event precipitation totals averaged 2 to 3.5 with the highest amounts along the fall line from Delaware through Bucks Counties. The heavy rain was caused by a low pressure system that emerged from the Gulf of Mexico on the 26th. The low moved northeast and reached the Carolinas during the evening of the 26th, Maryland early on the 27th and passed near New York City at 7 a.m. EST on the 27th.",74
512911,PHILADELPHIA CO.,(PHL)PHILADELPHIA IN,04/30/2014,1357,Flood, , ,0,0,1000000,0,PA,EST-5, ,83547,C,101,PHI,0,0,River/Stream Gage,Heavy Rain, , ,2,E,1,SW,BRIDESBURG,04/30/2014,2359,39.8837,-75.2134,39.993,-75.0816,"Very heavy rain caused widespread poor drainage, moderate to major creek and river flooding in Philadelphia. Flooding along the Schuylkill River was the worst since Tropical Storm Floyd on September 16, 1999.  Even moderate tidal flooding occurred on the night of the 30th. The flooding also affected regional rail lines as SEPTA service was suspended through May 1st between Manayunk and Norristown. Air travel was no better at Philadelphia International Airport as flight delays reached around two hours at the height of the storm and one third of all arriving and departing flights were cancelled on April 30th. In Manayunk, three people were rescued from the top of a SEPTA bus as Main Street was severely flooded. Residents were evacuated from an apartment complex on the river. Road closures included Martin Luther King, Kelly and Lincoln Drives.   ||The worst damage to city structures occurred at the Water Works facility and to the Gorgas Bridge on Forbidden Drive. About thirty residents on Venice Island Lofts suffered heavy apartment flooding and about thirty vehicles were towed. The paper factory on Venice Island was also damaged. The Manayunk Brewery suffered significant damage and was closed for several weeks as were some of its neighboring businesses. The Green Towne Montessori School was also heavily flooded. The water department responded to over 100 reports of residential basement flooding.||The Frankford Creek at Castor Avenue had moderate flooding and twice rose above its 7 foot flood stage, first from 257 p.m. EDT through 323 p.m. EDT on the 30th with a crest of 7.28 feet at 315 p.m. EDT. The Frankford Creek at Castor Avenue again rose above its flood stage from 453 p.m. EDT through 837 p.m. EDT on the 30th, with moderate flooding occurring and a higher crest of 9.50 feet at 615 p.m. EDT. The Pennypack Creek at the Rhawn Street Bridge had major flooding and was above its 7 foot flood stage from 307 p.m. EDT on the 30th through 530 a.m. EDT on May 1st. It crested at 12.03 feet at Midnight EDT on May 1st. It was the 6th highest crest on record and the highest since Tropical Storm Irene on August 28, 2011.  |  |The Wissahickon Creek at its mouth had moderate flooding and was above its 5 foot flood stage from 405 p.m. EDT on the 30th through 837 a.m. EDT on May 1st. It crested at 8.30 feet at 1200 a.m. EDT on May 1st. This was the highest crest recorded since September 8, 2011.  The Schuylkill River at Philadelphia had moderate flooding and was above its 11 foot flood stage from 624 p.m. EDT on the 30th through 626 p.m. EDT on May 1st. It crested at 13.91 feet at 400 a.m. EDT on May 1st. This was historically the 7th highest crest on record for the river and the highest crest since September 17, 1999 associated with Tropical Storm Floyd.  | |The onshore flow that started on the 29th caused minor tidal flooding in Philadelphia with both high tide cycles on the 30th.  But, the combination of the residual onshore flow and the freshwater runoff caused moderate tidal flooding with the high tide cycle early on May 1st. The high tide in Philadelphia reached 9.94 feet above mean lower low water. Moderate tidal flooding starts at 9.2 feet above mean lower low water. This was the 7th highest tide on record in Philadelphia.||Event precipitation totals included 5.45 inches in Rockledge, 4.91 inches at the Northeast Philadelphia Airport, 4.87 inches in Somerton and Philadelphia and 4.81 inches at the Philadelphia International Airport.","A slow moving low pressure system and a deep southerly flow from the Gulf of Mexico and then the Atlantic Ocean dropped heavy rain across Eastern Pennsylvania centered on the 30th. Event precipitation totals averaged from 3 to 6 inches, with the highest amounts in the Philadelphia suburbs. This caused poor drainage and creek and river flooding that reached major levels around the Philadelphia Metropolitan Area. Over 1,000 people had to be evacuated from flooded homes and apartments. The American Red Cross opened several shelters and comfort stations in Delaware and Chester Counties. Numerous water rescues and road closures occurred. the evening commute on the 30th and the morning commute on May 1st were greatly impacted. Regional commuter rail lines in and around Philadelphia had major delays. The Schuylkill River had its highest crest since Tropical Storm Floyd in September of 1999. Other creeks and rivers had their highest crest since Tropical Storm Irene in August of 2011. The steady rain began around noon EDT on the 29th. The rain fell at a fairly steady light to moderate pace until the 30th. Then, the rain fell heavy at times from the morning into the evening of the 30th. Rainfall amounts of around 2 inches fell in the six hour period from 2 p.m. EDT through 8 p.m. EDT on the 30th in the local Philadelphia area.  The rain ended from south to north between Midnight EDT and 6 a.m. EDT on May 1st. |  |The heavy rain was caused by the combination of a strong high pressure system that built over the Canadian Maritimes that initiated the onshore flow and a strong, but slow moving low pressure system. The low pressure system was located in northwest Missouri on the morning of the 29th. It moved northeast to near Chicago during the afternoon of the 29th. The low pressure system then became nearly stationary in southern Wisconsin as its cold front reached Ohio early on the 30th. Then a new low pressure system developed on the frontal boundary and was over Eastern Tennessee on the morning of the 30th. The low pressure system reached West Virginia during the late afternoon on the 30th as its warm front started to move through Delmarva. The low pressure system reached north central Maryland at 11 p.m. EDT on the 30th as its warm front reached extreme southeast Pennsylvania and central New Jersey. The low pressure system reached the Allentown, Pennsylvania area at 5 a.m. EDT on May 1st and then was absorbed again into the frontal boundary associated with the original low as it moved into New York State that morning. The steady rain ended as the low pressure system passed north of Pennsylvania.",75
521082,PHILADELPHIA CO.,(PHL)PHILADELPHIA IN,05/01/2014,0,Flood, , ,0,0,1000000,0,PA,EST-5, ,83768,C,101,PHI,0,0,River/Stream Gage,Heavy Rain, , ,2,E,1,SW,BRIDESBURG,05/01/2014,1726,39.88,-75.213,39.993,-75.0816,"Very heavy rain caused widespread poor drainage, moderate to major creek and river flooding in Philadelphia. Flooding along the Schuylkill River was the worst since Tropical Storm Floyd on September 16, 1999.  Even moderate tidal flooding occurred on the night of April 30th. The flooding also affected regional rail lines as SEPTA service was suspended through May 1st between Manayunk and Norristown. Air travel was no better at Philadelphia International Airport as flight delays reached around two hours at the height of the storm and one third of all arriving and departing flights were cancelled on April 30th. In Manayunk, three people were rescued from the top of a SEPTA bus as Main Street was severely flooded. Residents were evacuated from an apartment complex on the river. Road closures included Martin Luther King, Kelly and Lincoln Drives.   ||The worst damage to city structures occurred at the Water Works facility and to the Gorgas Bridge on Forbidden Drive. About thirty residents on Venice Island Lofts suffered heavy apartment flooding and about thirty vehicles were towed. The paper factory on Venice Island was also damaged. The Manayunk Brewery suffered significant damage and was closed for several weeks as were some of its neighboring businesses. The Green Towne Montessori School was also heavily flooded. The water department responded to over 100 reports of residential basement flooding.| |The Frankford Creek at Castor Avenue had moderate flooding and twice rose above its 7 foot flood stage, first from 257 p.m. EDT through 323 p.m. EDT on April 30th with a crest of 7.28 feet at 315 p.m. EDT. The Frankford Creek at Castor Avenue again rose above its flood stage from 453 p.m. EDT through 837 p.m. EDT on April 30th, with moderate flooding occurring and a higher crest of 9.50 feet at 615 p.m. EDT. The Pennypack Creek at the Rhawn Street Bridge had major flooding and was above its 7 foot flood stage from 307 p.m. EDT on April 30th through 530 a.m. EDT on May 1st. It crested at 12.03 feet at Midnight EDT on May 1st. It was the 6th highest crest on record and the highest since Tropical Storm Irene on August 28, 2011.  |  |The Wissahickon Creek at its mouth had moderate flooding and was above its 5 foot flood stage from 405 p.m. EDT on April 30th through 837 a.m. EDT on May 1st. It crested at 8.30 feet at 1200 a.m. EDT on May 1st. This was the highest crest recorded since September 8, 2011.  The Schuylkill River at Philadelphia had moderate flooding and was above its 11 foot flood stage from 624 p.m. EDT on April 30th through 626 p.m. EDT on May 1st. It crested at 13.91 feet at 400 a.m. EDT on May 1st. This was historically the 7th highest crest on record for the river and the highest crest since September 17, 1999 associated with Tropical Storm Floyd.  | |The onshore flow that started on April 29th caused minor tidal flooding in Philadelphia with both high tide cycles on April 30th.  But, the combination of the residual onshore flow and the freshwater runoff caused moderate tidal flooding with the high tide cycle early on May 1st. The high tide in Philadelphia reached 9.94 feet above mean lower low water. Moderate tidal flooding starts at 9.2 feet above mean lower low water. This was the 7th highest tide on record in Philadelphia.||Event precipitation totals included 5.45 inches in Rockledge, 4.91 inches at the Northeast Philadelphia Airport, 4.87 inches in Somerton and Philadelphia and 4.81 inches at the Philadelphia International Airport.","A slow moving low pressure system and a deep southerly flow from the Gulf of Mexico and then the Atlantic Ocean dropped heavy rain across Eastern Pennsylvania centered on April 30th. Event precipitation totals averaged from 3 to 6 inches, with the highest amounts in the Philadelphia suburbs. This caused poor drainage and creek and river flooding that reached major levels around the Philadelphia Metropolitan Area. Over 1,000 people had to be evacuated from flooded homes and apartments. The American Red Cross opened several shelters and comfort stations in Delaware and Chester Counties. Numerous water rescues and road closures occurred. the evening commute on April 30th and the morning commute on May 1st were greatly impacted. Regional commuter rail lines in and around Philadelphia had major delays. The Schuylkill River had its highest crest since Tropical Storm Floyd in September of 1999. Other creeks and rivers had their highest crest since Tropical Storm Irene in August of 2011. The steady rain began around noon EDT on April 29th. The rain fell at a fairly steady light to moderate pace until the 30th. Then, the rain fell heavy at times from the morning into the evening of April 30th. Rainfall amounts of around 2 inches fell in the six hour period from 2 p.m. EDT through 8 p.m. EDT on April 30th in the local Philadelphia area. The rain ended from south to north between Midnight EDT and 6 a.m. EDT on May 1st.||The heavy rain was caused by the combination of a strong high pressure system that built over the Canadian Maritimes that initiated the onshore flow and a strong, but slow moving low pressure system. The low pressure system was located in northwest Missouri on the morning of April 29th. It moved northeast to near Chicago during the afternoon of April 29th. The low pressure system then became nearly stationary in southern Wisconsin as its cold front reached Ohio early on April 30th. Then a new low pressure system developed on the frontal boundary and was over Eastern Tennessee on the morning of April 30th. The low pressure system reached West Virginia during the late afternoon on April 30th as its warm front started to move through Delmarva. The low pressure system reached north central Maryland at 11 p.m. EDT on April 30th as its warm front reached extreme southeast Pennsylvania and central New Jersey. The low pressure system reached the Allentown, Pennsylvania area at 5 a.m. EDT on May 1st and then was absorbed again into the frontal boundary associated with the original low as it moved into New York State that morning. The steady rain ended as the low pressure system passed north of Pennsylvania.",76
521137,PHILADELPHIA CO.,MANAYUNK,05/16/2014,1421,Flood, , ,0,0,0,0,PA,EST-5, ,84083,C,101,PHI,0,0,River/Stream Gage,Heavy Rain, , ,1,ESE,2,E,MANAYUNK,05/16/2014,2346,40.013,-75.2069,40.0172,-75.2012,The Wissahickon Creek at its mouth was above its 5 foot flood stage from 321 p.m. EDT through 1246 a.m. EDT on the 17th. It crested at 5.82 feet at 845 p.m. EDT. Event precipitation totals included 2.11 inches in Wyndmoor and 1.57 inches at the Philadelphia International Airport.,"A slow moving cold front with waves of low pressure along it brought heavy rain to Southeast Pennsylvania on the 16th. This caused poor drainage flooding as well as some minor flooding of creeks in and around Philadelphia. Rain began during the early morning of the 16th and fell heavy at times throughout the event. It ended during the late afternoon with event totals of two to four inches, highest in Montgomery County. The combination of the heavy rain runoff, higher astronomical tides associated with the recent full moon and an up the Delaware Bay flow on the 16th caused minor tidal flooding along the Delaware River and some of its tidal tributaries with the overnight high tide cycle on the 16th. The high tide in Philadelphia reached 8.2 feet above mean lower low water, the threshold for the start of minor tidal flooding.",77
525021,PHILADELPHIA CO.,MANAYUNK,06/09/2014,2120,Flood, , ,0,0,0,0,PA,EST-5, ,84665,C,101,PHI,0,0,River/Stream Gage,Heavy Rain, , ,1,ESE,1,WSW,GERMANTOWN,06/10/2014,116,40.0127,-75.2061,40.0258,-75.191,The runoff from the heavy rain that fell during the late afternoon and early evening of the 9th in Montgomery County caused minor flooding along the Wissahickon Creek overnight on the 9th in Philadelphia. The Wissahickon Creek at its mouth in Philadelphia was above its 5 foot flood stage from 1030 p.m. EDT on the 9th through 216 a.m. EDT on the 10th. It crested at 5.43 feet at 1215 a.m. EDT on the 10th.,"A cluster of slow moving thunderstorms with very heavy rain caused drainage and smaller creek flash flooding in southeastern Pennsylvania during the late afternoon and early evening of the 9th. Event totals where flash flooding occurred reached between two and three inches, most of which fell within an hour.",78
555904,PHILADELPHIA CO.,TORRESDALE,01/18/2015,1440,Flood, , ,0,0,0,0,PA,EST-5, ,91689,C,101,PHI,0,0,River/Stream Gage,Heavy Rain, , ,1,WSW,2,NNW,TACONY,01/18/2015,1942,40.0442,-75.0192,40.0431,-75.0393,"The Pennypack Creek at the Rhawn Street Bridge had minor flooding and was above its 7 foot flood stage from 240 p.m. EST through 742 p.m. EST on the 18th. It crested at 7.71 feet at 430 p.m. EST. Event precipitation totals included 1.95 inches in Rhawnhurst, 1.84 inches at the Philadelphia International Airport and 1.71 inches in Wyndmoor.",An inverted trough that brought freezing rain in the morning acted as a conduit to bring heavy rain into the region from the mid morning into the mid afternoon of the 18th. The rain itself ended during the late afternoon and early evening on the 18th.  Event precipitation totals averaged around 1.5 inches and caused considerable poor drainage flooding as well as flooding along some smaller creeks and rivers in Philadelphia and Delaware Counties.,79
