EVENT_ID,CZ_NAME_STR,BEGIN_LOCATION,BEGIN_DATE,BEGIN_TIME,EVENT_TYPE,MAGNITUDE,TOR_F_SCALE,DEATHS_DIRECT,INJURIES_DIRECT,DAMAGE_PROPERTY_NUM,DAMAGE_CROPS_NUM,STATE_ABBR,CZ_TIMEZONE,MAGNITUDE_TYPE,EPISODE_ID,CZ_TYPE,CZ_FIPS,WFO,INJURIES_INDIRECT,DEATHS_INDIRECT,SOURCE,FLOOD_CAUSE,TOR_LENGTH,TOR_WIDTH,BEGIN_RANGE,BEGIN_AZIMUTH,END_RANGE,END_AZIMUTH,END_LOCATION,END_DATE,END_TIME,BEGIN_LAT,BEGIN_LON,END_LAT,END_LON,EVENT_NARRATIVE,EPISODE_NARRATIVE,ABSOLUTE_ROWNUMBER
303307,PHILADELPHIA CO.,FOX CHASE,04/16/2011,1954,Flood, , ,0,0,0,0,PA,EST-5, ,48676,C,101,PHI,0,0,Newspaper,Heavy Rain, , ,2,ESE,0,SE,SHAWMONT,04/17/2011,650,40.0588,-75.0506,40.0251,-75.2244,"Heavy rain caused poor drainage flooding as well as flooding along several creeks within Philadelphia. Moderate flooding occurred along the Pennypack and Frankford Creeks and minor flooding occurred along the Wissahickon Creek. Flooding along the Wissahickon Creek closed Lincoln Drive. The eastbound lanes of the Schuylkill Expressway were closed near Montgomery Drive because of a mudslide. Flooding also occurred in the city's Bridesburg section near the Frankford Creek. A man had to be rescued from the top of a vehicle at the intersection of Hadley and Richmond Streets. Tidal flooding also occurred along the Delaware River.||The Frankford Creek at Castor Avenue was above its 7 foot flood stage from 902 p.m. EDT through 1027 p.m. EDT on the 16th. It crested at 9.84 feet at 930 p.m. EDT. The Pennypack Creek at the Rhawn Street Bridge was above its 7 foot flood stage from 929 p.m. EDT on the 16th through 620 a.m. EDT on the 17th. It crested at 10.18 feet at 1130 p.m. EDT on the 16th. The Wissahickon Creek at its mouth was above its 5 foot flood stage from 854 p.m. EDT on the 16th through 750 a.m. EDT on the 17th. It crested at 6.91 feet at 230 a.m. EDT on the 17th. Storm precipitation totals included 3.12 inches at the Philadelphia International Airport, 2.98 inches at the Northeast Philadelphia Airport, 2.78 inches in Wyndmoor and 2.51 inches in Rockledge.",Heavy rain caused poor drainage flooding in Eastern Pennsylvania and mainly minor to moderate creek and  river flooding in Berks County and Southeastern Pennsylvania. The rain began during the morning of the 16th and fell at its heaviest during thunderstorms on the evening of the 16th. The rain ended during the early morning of the 17th. Precipitation totals averaged 1.5 to 3.0 inches with the highest amounts along the interstate 95 corridor and the Poconos.||The heavy rain was caused by a deep low pressure system that emerged from the Rockies on the 14th and moved northeast and reached the Great Lakes on the morning of the 16th and then north into Canada that evening. A strong high pressure system preceded it across southeast Canada and both pumped considerable moisture into the region from the Gulf of Mexico and the Atlantic Ocean. The rain ended shortly after the low's occluded front moved through Pennsylvania.,55
336851,PHILADELPHIA CO.,CRESCENTVILLE,07/25/2011,1929,Flood, , ,0,0,0,0,PA,EST-5, ,53063,C,101,PHI,0,0,River/Stream Gage,Heavy Rain, , ,1,ENE,1,SSW,CRESCENTVILLE,07/26/2011,58,40.0332,-75.0834,40.0176,-75.1087,Thunderstorms with heavy rain caused poor drainage flooding and creek flooding within Philadelphia. The Frankford Creek at Castor Avenue was briefly above its 7 foot flood stage from 829 p.m. through 832 p.m. EDT on the 25th. It crested at 7.06 at 830 p.m. EDT. The Pennypack Creek at the Rhawn Street Bridge was above its 7 foot flood stage from 104 a.m. EDT through 158 a.m. EDT on the 26th. It crested at 7.11 feet at 130 a.m. EDT. Event precipitation totals included 1.37 inches in Northeast Philadelphia.,"Several waves of thunderstorms preceding a cold front produced heavy rain across Eastern Pennsylvania during the afternoon and first half of the evening on the 25th. The thunderstorms caused poor drainage and creek flooding in the Lehigh Valley and the local Philadelphia area. Where thunderstorms moved over similar locations,  storm totals reached 3 to 6 inches in Northampton and Carbon Counties and 2 to 4 inches in Chester County.",56
345527,PHILADELPHIA CO.,FOX CHASE,08/14/2011,1045,Flood, , ,0,0,0,0,PA,EST-5, ,53737,C,101,PHI,0,0,River/Stream Gage,Heavy Rain, , ,2,ESE,2,NNW,TACONY,08/14/2011,1045,40.0588,-75.0506,40.0465,-75.0483,Runoff flooding from heavy rain continued on the Pennypack Creek through the afternoon and into the evening of the 14th. The Pennypack Creek at the Rhawn Street Bridge was above its 7 foot flood stage from 651 a.m. EDT through 821 p.m. EDT on the 14th. It crested at 7.64 feet at 415 p.m. EDT. Event precipitation totals included 5.80 inches in Rockledge and at the Philadelphia International Airport and 4.18 inches in Wyndmoor.,"A series of thunderstorms preceding a cold front dropped three to six inches of rain across sections of Berks County, the Lehigh Valley, Philadelphia and its nearby suburbs. This caused flash flooding and flooding of streams and creeks that started in Berks County and the Lehigh valley during the evening of the 13th and spread to the local Philadelphia area during the morning of the 14th.",57
346404,PHILADELPHIA CO.,TORRESDALE,08/19/2011,1957,Flood, , ,0,0,0,0,PA,EST-5, ,57711,C,101,PHI,0,0,River/Stream Gage,Heavy Rain, , ,1,WNW,1,NW,BUSTLETON,08/20/2011,228,40.0563,-75.013,40.0889,-75.0432,"Runoff from the heavy rain that fell in Montgomery County caused flooding along sections of the Wissahickon and Pennypack Creeks within Philadelphia. While event precipitation totals were less than one inch in Philadelphia, they reached between two and three inches in lower Montgomery County.  The Wissahickon Creek at its mouth was above its 5 foot flood stage from 857 p.m. EDT on the 19th through 328 a.m. EDT on the 20th. It crested at 5.28 feet at Midnight EDT on the 20th. The Pennypack Creek at the Rhawn Street Bridge was above its 7 foot flood stage from 1112 p.m. EDT on the 19th through 226 a.m. EDT on the 20th. It crested at 7.92 feet at 100 a.m. EDT on the 20th.",The runoff from heavy rain caused flash flooding in Montgomery County during the evening of the 19th and creek flooding overnight on the 19th in lower Montgomery County and eastern Philadelphia.,58
343372,PHILADELPHIA CO.,BYBERRY,08/28/2011,900,Flood, , ,0,0,100000,0,PA,EST-5, ,54808,C,101,PHI,0,0,Emergency Manager,Heavy Rain / Tropical System, , ,1,NW,3,NNW,CHESTNUT HILL,08/29/2011,4,40.1245,-75.0085,40.1084,-75.2149,"The Schuylkill River flooded businesses in the Manayunk section of the city. Lincoln Drive was flooded by the Wissahickon Creek. The heavy rain caused the collapse of seven buildings and damage to thirteen other structures within the city.||The Schuylkill River in Philadelphia had moderate flooding and its seventh highest crest on record, highest since Hurricane Floyd in 1999. The river was above its 11 foot flood stage from 339 a.m. EDT on the 28th through 104 a.m. EDT on the 29th. It crested at 13.57 feet at 145 p.m. EDT on the 28th.||The Wissahickon Creek at its mouth had major flooding, tied its second highest crest on record and was the highest crest since late September of 2004. It was above its 5 foot flood stage from 1022 p.m. EDT on the 27th through 605 p.m. EDT on the 28th. It crested at 10.54 feet at 700 a.m. EDT on the 28th. ||The Pennypack Creek at the Rhawn Street Bridge had moderate flooding and was above its 7 foot flood stage from 945 p.m. EDT on the 27th through 245 p.m. EDT on the 28th. It crested at 9.39 feet at 1045 p.m. EDT on the 27th. The Frankford Creek at Castor Avenue had major flooding and the second highest crest on record (behind the remnants of Hurricane Jeanne in late September 2004). It was above its 7 foot flood stage from 957 p.m. EDT on the 27th through 414 a.m. EDT on the 28th. It crested at 13.15 feet at 1145 p.m. EDT on the 27th.||Event rainfall totals included 6.97 inches in Rockledge, 6.89 inches in Lawndale, 6.70 inches in Wyndmoor, 6.49 inches in Philadelphia, 6.16 inches at the Northeast Philadelphia Airport and 5.70 inches at the Philadelphia International Airport.","Irene produced heavy flooding rain, tropical storm force wind gusts with hundreds of thousands of outages, moderate tidal flooding along the Delaware River and one flooding related death in Eastern Pennsylvania over the weekend of August 27th and 28th. Moderate stream and river flooding occurred in the Poconos and Lehigh Valley and moderate to major river flooding occurred in southeast Pennsylvania. For many places in southeastern Pennsylvania, it was the worst creek and river flooding since Hurricane Floyd in 1999 or the remnants of Hurricane Jeanne in 2004. Flooding along non-tidal sections of the Delaware River was minor to moderate. There were two direct storm caused deaths: a wind related death in Monroe County and a drowning in Montgomery County.  About 500,000 PECO Energy and 420,000 Pennsylvania Power and Light customers lost power in Eastern Pennsylvania. For both utilities this ranked within the top five outages of all time.  Preliminary damage estimates were around six million dollars. In addition to property damage, the winds and rains badly damaged the corn crop in southeastern Pennsylvania. The Delaware Water Gap National Recreational Area was closed through Labor Day Weekend (September 5th). ||Tropical storm force wind gusts overspread Eastern Pennsylvania during the evening of the 27th and persisted into the afternoon of the 28th. Peak wind gusts averaged around 50 mph. The strongest winds associated with Irene occurred at two distinct times. The first surge occurred during bands of heavier rain during the evening of the 27th and early morning of the 28th. The second peak occurred during the afternoon of the 28th when skies were clearing and deeper mixing of the atmosphere brought stronger winds to the ground. Most of the peak wind gusts occurred at this time. The rain associated with Irene overspread Eastern Pennsylvania during the late morning on the 27th, fell at its heaviest from during the evening of the 27th into the early morning of the 28th and ended during the early afternoon on the 28th. Event precipitation totals averaged 3 to 7 inches and caused widespread flooding. Because the flash flooding and flooding blended into one, all flooding related stormdata county entries were combined into one under flood events. The storm surge of 3 to 5 feet caused moderate tidal flooding along tidal sections of the Delaware River overnight on the 27th. Minor tidal flooding occurred during the high tide cycles from the 29th through the 31st. | |In Stroudsburg (Monroe County), a 44-year-old man died when a tree fell on him in his backyard. He pushed his son to safety. Governor Tom Corbett declared a state of emergency for the city of Philadelphia and the surrounding suburbs. The Southeastern Pennsylvania Transportation Authority halted all commuter rail service during the evening of the 27th as multiple tornado warnings were issued.  Three large shelters on the evening of August 27th in Philadelphia. The Philadelphia International Airport closed at 1030 p.m. EDT on the 27th and reopened on Monday the 29th. In Philadelphia, the storm left thousands without power. More than 500 trees fell in the city, seven buildings collapsed and twenty roads were closed. PECO Energy restored power by August 31st.||The highest wind gusts recorded during Irene were 57 mph in Mount Pocono (Monroe County), 53 mph in Allentown (Lehigh County), 52 mph at the Philadelphia International Airport (Philadelphia County), 48 mph in Reading (Berks County), 46 mph in Coatesville (Chester County), 45 mph in Northeast Philadelphia (Philadelphia County), 44 mph in Pottstown (Montgomery County), 44 mph in Newbold (Bucks County) and 40 mph in Quakertown (Bucks County). The high tide in Philadelphia reached 9.89 feet above mean lower low water during the early morning of the 28th. Moderate tidal flooding begins at 9.20 feet above mean lower low water. ||Hurricane Irene formed east of the Leeward Islands on Saturday the 20th. It moved northeast and passed over Puerto Rico overnight on the 21st. As Irene moved off the island, it intensified into a hurricane. Irene just bypassed the island of Hispaniola to its north and then passed over the Eastern Bahamas on the 25th as it reached category three hurricane strength. From the Bahamas, Irene moved nearly due north and slowly weakened to a category two hurricane on the 26th and a category one hurricane on the 27th. Irene made her initial landfall near Cape Lookout, North Carolina at 8 a.m. EDT on the 27th and then proceeded to the northnortheast and went back over the Atlantic Ocean near the Virginia and North Carolina border at 7 p.m. EDT on the 27th. From there Irene paralleled the Delmarva Peninsula and the center passed about 15 miles east of Delaware between 3 a.m. and 4 a.m. EDT on the 28th. Irene made her second landfall as a tropical storm on Brigantine Island, just north of Atlantic City, New Jersey at 535 a.m. EDT on the 28th. From there the center of Irene moved along eastern parts of Ocean and Monmouth Counties and was located near Tinton Falls Township in Monmouth County at 8 a.m. EDT on the 28th. At about 9 a.m. EDT the center of Irene passed over New York City.||Irene helped shatter all time monthly precipitation records. In Philadelphia, the 19.31 inches of rain established a new all-time August as well as monthly record. It was nearly half of the normal yearly precipitation total. A new August as well as all-time monthly rainfall record of 13.47 inches was also established in Allentown.",59
350542,PHILADELPHIA CO.,TORRESDALE,09/06/2011,1407,Flood, , ,0,0,0,0,PA,EST-5, ,55248,C,101,PHI,0,0,River/Stream Gage,Heavy Rain, , ,1,SSE,2,SE,(PHL)PHILADELPHIA IN,09/07/2011,1700,40.03,-74.99,39.86,-75.23,"The first round of heavier rain that started on the 6th produced widespread poor drainage, creek and river flooding in Philadelphia that persisted through the afternoon of the 7th. A mudslide forced the closure of the Schuylkill Expressway on the 7th between the Blue Route (Interstate 476) in Montgomery County and Girard Avenue in Philadelphia.The Schuylkill River in Philadelphia was above its 11 foot flood stage from 425 a.m. EDT through 6 p.m. EDT on the 7th.  It crested at 12.03 feet at 1230 p.m. EDT. The Wissahickon Creek at its mouth was above its 5 foot flood stage from 715 p.m. EDT on the 6th through 342 p.m. EDT on the 7th. It crested at 6.22 feet at Noon EDT on the 7th. The Pennypack Creek at the Rhawn Street Bridge had moderate flooding and was above its 7 foot flood stage from 307 p.m. EDT on the 6th through 2 a.m. EDT on the 7th. It crested at 9.46 feet at 1030 p.m. EDT on the 6th.  The Pennypack Creek at the Rhawn Street Bridge was above its 7 foot flood stage again from 630 a.m. EDT through 1115 a.m. EDT on the 7th. It crested at 8.34 feet at 930 a.m. EDT. The Frankford Creek at Castor Avenue was above its 7 foot flood stage from 711 p.m. EDT through 726 p.m. EDT on the 6th.  It crested at 7.21 feet at 715 p.m. EDT.","The remnants of Tropical Storm Lee that interacted with a stalled frontal boundary produced several days with periods of heavy rain across Eastern Pennsylvania from the 5th into the 8th. Event precipitation totals averaged 4 to 9 inches, except in Berks County where 6 to 12 inches fell.  One drowning occurred in Philadelphia. The heavy rain caused widespread poor drainage flooding as well as moderate flooding along the Delaware and Schuylkill Basins and minor to moderate flooding along the Lehigh River Basin. Crests in the upper Schuylkill, Lehigh and Delaware River Basins were higher than what occurred with Irene the previous month and the highest crests since late June of 2006 in most instances. The crests along the Delaware River were 2 to 4 feet higher than what occurred during Irene. Some of the smaller streams in southeastern Pennsylvania reached major flooding levels, but most of those crests were lower than what occurred with Irene. In addition to the freshwater flooding, moderate tidal flooding occurred along the lower Delaware River and its tributaries. ||In the most recent available flooding assessment for Eastern Pennsylvania, there were 22 homes and businesses that were destroyed, 201 that suffered major damage, 672 that had minor damage and 1217 others that were affected. The preliminary damage estimate for the state of Pennsylvania was five hundred million dollars.  Please look for possible updates in future monthly issues of stormdata.| |The combination of fresh water runoff and a weak southerly flow produced moderate tidal flooding during the evening high tide cycles from the 7th through the 9th and minor tidal flooding with all of the other high tide cycles from the evening of the 6th through overnight on the 11th. The highest tides occurred during the evening high tide cycle on the 8th in Philadelphia and Delaware Counties and the evening high tide cycle on the 9th in Bucks County.  The evening high tide on the 8th in Philadelphia reached 9.41 feet above mean lower low water. Moderate tidal flooding starts at 9.2 feet above mean lower low water. The high tide in Newbold Island (Bucks County) reached 12.11 feet above mean lower low water. There is no current categorical tide gage information for this site.  ||Tropical Storm Lee made landfall in Louisiana during the morning of the 4th and moved slowly northeast. An approaching cold front from the Mississippi Valley reached Lee by the morning of the 5th and transformed it to an extratropical system on the 5th in Mississippi. The same cold front acted as a conduit for Lee's moisture farther to the northeast. Showers and thunderstorms from that approaching cold front arrived during the evening and overnight on the 5th  and set off the first round of flash flooding rains in Northeast Pennsylvania. The front then stalled just south of Delmarva on the 6th. A relative lull in the rain then occurred during the morning of the 6th. As the front started to back north as a warm front later in the day on the 6th, more bands of heavier rain returned that afternoon and particularly that evening. A blocking weather pattern then moved the frontal boundary little from the morning of the 7th into the morning of the 8th across southeast Pennsylvania. A couple of bands of flash flood producing rains started to form and move east into Eastern Pennsylvania during the late afternoon and evening of the 7th and continued through the night.  The frontal boundary started to drift offshore later in the day on the 8th and most of the precipitation associated with Lee was done.",60
350543,PHILADELPHIA CO.,TORRESDALE,09/08/2011,103,Flood, , ,0,0,0,0,PA,EST-5, ,55248,C,101,PHI,0,0,River/Stream Gage,Heavy Rain, , ,1,SSE,2,SE,(PHL)PHILADELPHIA IN,09/08/2011,1918,40.03,-74.99,39.86,-75.23,"The second round of heavier rain that started overnight on the 7th produced additional widespread poor drainage, creek and river flash flooding and flooding in Philadelphia that persisted into the evening of the 8th. Major flooding occurred along most of the smaller creeks within the city. Along the Schuylkill River, Main Street in Manayunk was flooded as was Kelly Drive. Kelly Drive was not re-opened until the 11th. Along the Wissahickon Creek, Lincoln Drive was closed.| |The Schuylkill River in Philadelphia was above its 11 foot flood stage from 203 a.m. EDT through 818 p.m. EDT on the 8th.  It crested at 12.53 feet at 5 a.m. EDT.  The Wissahickon Creek at its mouth with the Schuylkill River had major flooding, its second highest crest on record and its highest crest since Hurricane Floyd on September 16, 1999. It was above its 5 foot flood stage from 226 a.m. EDT through 626 p.m. EDT on the 8th. It crested at 10.89 feet at 10 a.m. EDT. The Pennypack Creek at the Rhawn Street Bridge had major flooding, its fourth highest crest on record and its highest crest since Hurricane Floyd on September 16, 1999. It was above its 7 foot flood stage from 352 a.m. EDT through 220 p.m. EDT on the 8th.  It crested at13.04 feet at 915 a.m. EDT on the 8th.  |The Frankford Creek at Castor Avenue had major flooding and its 5th highest crest on record.  It was above its 7 foot flood stage from 237 a.m. EDT through 804 a.m. EDT on the 8th.  It crested at 11.39 feet at 415 a.m. EDT.|Entire event rainfall totals included 7.34 inches in Center City Philadelphia, 6.35 inches at the Philadelphia International Airport and 4.63 inches at the Northeast Philadelphia Airport.","The remnants of Tropical Storm Lee that interacted with a stalled frontal boundary produced several days with periods of heavy rain across Eastern Pennsylvania from the 5th into the 8th. Event precipitation totals averaged 4 to 9 inches, except in Berks County where 6 to 12 inches fell.  One drowning occurred in Philadelphia. The heavy rain caused widespread poor drainage flooding as well as moderate flooding along the Delaware and Schuylkill Basins and minor to moderate flooding along the Lehigh River Basin. Crests in the upper Schuylkill, Lehigh and Delaware River Basins were higher than what occurred with Irene the previous month and the highest crests since late June of 2006 in most instances. The crests along the Delaware River were 2 to 4 feet higher than what occurred during Irene. Some of the smaller streams in southeastern Pennsylvania reached major flooding levels, but most of those crests were lower than what occurred with Irene. In addition to the freshwater flooding, moderate tidal flooding occurred along the lower Delaware River and its tributaries. ||In the most recent available flooding assessment for Eastern Pennsylvania, there were 22 homes and businesses that were destroyed, 201 that suffered major damage, 672 that had minor damage and 1217 others that were affected. The preliminary damage estimate for the state of Pennsylvania was five hundred million dollars.  Please look for possible updates in future monthly issues of stormdata.| |The combination of fresh water runoff and a weak southerly flow produced moderate tidal flooding during the evening high tide cycles from the 7th through the 9th and minor tidal flooding with all of the other high tide cycles from the evening of the 6th through overnight on the 11th. The highest tides occurred during the evening high tide cycle on the 8th in Philadelphia and Delaware Counties and the evening high tide cycle on the 9th in Bucks County.  The evening high tide on the 8th in Philadelphia reached 9.41 feet above mean lower low water. Moderate tidal flooding starts at 9.2 feet above mean lower low water. The high tide in Newbold Island (Bucks County) reached 12.11 feet above mean lower low water. There is no current categorical tide gage information for this site.  ||Tropical Storm Lee made landfall in Louisiana during the morning of the 4th and moved slowly northeast. An approaching cold front from the Mississippi Valley reached Lee by the morning of the 5th and transformed it to an extratropical system on the 5th in Mississippi. The same cold front acted as a conduit for Lee's moisture farther to the northeast. Showers and thunderstorms from that approaching cold front arrived during the evening and overnight on the 5th  and set off the first round of flash flooding rains in Northeast Pennsylvania. The front then stalled just south of Delmarva on the 6th. A relative lull in the rain then occurred during the morning of the 6th. As the front started to back north as a warm front later in the day on the 6th, more bands of heavier rain returned that afternoon and particularly that evening. A blocking weather pattern then moved the frontal boundary little from the morning of the 7th into the morning of the 8th across southeast Pennsylvania. A couple of bands of flash flood producing rains started to form and move east into Eastern Pennsylvania during the late afternoon and evening of the 7th and continued through the night.  The frontal boundary started to drift offshore later in the day on the 8th and most of the precipitation associated with Lee was done.",61
349360,PHILADELPHIA CO.,FOX CHASE,09/23/2011,2045,Flood, , ,0,0,0,0,PA,EST-5, ,55984,C,101,PHI,0,0,River/Stream Gage,Heavy Rain, , ,2,ESE,2,NNW,TACONY,09/24/2011,100,40.0588,-75.0506,40.0454,-75.0438,"Heavy rain caused flooding along the Pennypack Creek. The Pennypack Creek at the Rhawn Street Bridge was above its 7 foot flood stage from 945 p.m. EDT on the 23rd through 2 a.m. EDT on the 24th. It crested at 8.45 feet at 1230 a.m. EDT on the 24th. Event precipitation totals included 2.35 inches at the Philadelphia International Airport, 2.20 inches in Wyndmoor and 1.82 inches in Rockledge.","Bands of showers and isolated thunderstorms with heavy rain moved through the region on the 23rd. They caused poor drainage, creek and river flooding in southeastern Pennsylvania from the morning of the 23rd into afternoon of the 24th. The Brandywine Creek Basin had the most widespread flooding. The heaviest rain fell during the late morning and evening on the 23rd. Event precipitation totals averaged two to four and a half inches with the axis of heaviest rain across northwest Chester and Montgomery Counties and southeast Berks County.",62
